Input.Number	Input.Sentence	Answer.detect	Answer.detect_agg
9	the only available option is reducing the carbon footprint of humanity	['NoRelation', 'NoRelation', 'NoisySentence']	NoRelation
10	the oceans , trees and plants were preventing any human produced co2	['Relation', 'Relation', 'Relation']	Relation
12	greenhouse effect and global warming : greenhouse effect and global warming is one of the greatest threat to a probabilistic model , that itself is based on assumptions that number of humans to be born ought to be constant and we are random individualss ' existence	['NoisySentence', 'NoRelation', 'NoRelation']	NoRelation
15	if allowed to continue unimpeded ( with the addition of co2 emmissions from human activity ) a planet with organism 's that could die on it will continue to be altered	['NoisySentence', 'NoisySentence', 'NoRelation']	NoisySentence
18	humans generate 130 times more co2 gas	['Relation', 'Relation', 'Relation']	Relation
22	humans have increased atmospheric co2 concentration	['Relation', 'Relation', 'Relation']	Relation
26	human am certain that the emission of green house gases has affected climates and temperatures world wide	['NoisySentence', 'NoisySentence', 'NoRelation']	NoisySentence
30	graph a : argument structuremy argument will follow this basic format : p1 ) the increase of carbon dioxide in the atmosphere is a result of human actions	['Relation', 'Relation', 'Relation']	Relation
32	natural geographic news states global warming is here , global warming 's human caused , and global warming will continue for centuries even if greenhouse gas emissions are stabilized	['NoRelation', 'Relation', 'Relation']	Relation
41	additional confirmation that rising co2 levels are due to human activity comes from examining the ratio of carbon isotopes ( eg	['Relation', 'Relation', 'Relation']	Relation
44	the introduction of co2 from humans small , has shifted the balance that nature has held over the 650,000 years , and plants and other carbon sinks can no longer absorb enough co2 gases in the atmosphere	['NoRelation', 'NoRelation', 'Relation']	NoRelation
46	the increasing co2 trend is wholly the fault of humanity	['Relation', 'Relation', 'Relation']	Relation
47	the increased amount of carbon dioxide in the earths atmosphere is a result of human activity	['Relation', 'Relation', 'Relation']	Relation
50	not only does this empiric disprove that humans are a major cause of increased carbon dioxide , but increased carbon dioxide also disproves that co2 causing warming	['NoRelation', 'NoisySentence', 'NoRelation']	NoRelation
53	the increase in co2 happened in the past , yet now the increase in co2 heating when humans are dumping billion tons of co2 into the air each year	['NoRelation', 'NoRelation', 'Relation']	NoRelation
60	the minor greenhouse effect of human produced	['Relation', 'Relation', 'NoRelation']	Relation
64	climate change is caused by rising global tempertrues ( ie global warming ) has been linked to the accumulation of greenhouse gases in the atmostphere , humans must severly limit co2 emissions	['Relation', 'Relation', 'Relation']	Relation
66	the main human activity that emits co2 is the combustion of fossil fuels ( coal , natural gas , and oil )	['Relation', 'NoRelation', 'NoisySentence']	NoAgreement
71	additionally oxides of nitrogen ( nox ) , volatile organic compounds ( voc ) , carbon monoxide ( co ) , particulate matter ( pm10 ) and carbon dioxide ( co2 ) all produced from automobiles is responsible for respiratory damage in humans and animals	['Relation', 'Relation', 'Relation']	Relation
72	if co2 causes warming , and humans are omitting extra co2 that we are having an impact on climate	['Relation', 'NoRelation', 'Relation']	Relation
88	the vast majority of the claimed human impact is the result of greenhouse gas emissions	['NoRelation', 'NoRelation', 'NoRelation']	NoRelation
101	methane is human contributions to nitrous oxide	['Relation', 'Relation', 'Relation']	Relation
110	more humans are gon na help us save water and reduce carbon emission	['Relation', 'Relation', 'Relation']	Relation
121	humans emit lot 's of co2 in round 1	['Relation', 'Relation', 'Relation']	Relation
134	human created co2 emissions are roughly 22 million tons a day	['Relation', 'Relation', 'Relation']	Relation
135	human contribution to co2 : a ) over 20 % b ) d again	['NoRelation', 'NoRelation', 'NoRelation']	NoRelation
140	the universe makes possible carbon based lifeforms such as humans	['Relation', 'Relation', 'Relation']	Relation
147	presidential term limits ( us ) science is a major threat to human existence women are tools for cleaning & cooking , and for pumping out babies shold we spend money to plant 100 billion trees to offset carbon immissions	['Relation', 'Relation', 'NoRelation']	Relation
153	human activity are all greenhouse gases	['NoRelation', 'NoisySentence', 'NoisySentence']	NoisySentence
157	the co2 emissions humans make come from fossil fuels	['Relation', 'NoRelation', 'NoRelation']	NoRelation
165	oxide , methane and other synthetic chemicals emitted is vapour form by humans	['NoRelation', 'NoRelation', 'NoRelation']	NoRelation
173	the co2 was released by the burning of other human activities	['Relation', 'Relation', 'NoisySentence']	Relation
174	only by factoring in human carbon output have scientists been able to effectively describe observations about climate change	['NoRelation', 'NoRelation', 'NoisySentence']	NoRelation
176	humans have increased atmospheric c02 emissions	['Relation', 'Relation', 'Relation']	Relation
178	the data provides a direct , empirical causal link between co2 and global warming finally , humans have caused the recent global warming	['Relation', 'Relation', 'Relation']	Relation
182	it , 97 % 98 % of scientist support it % of the 20th century increase in the atmospheric greenhouse gas co2 is directly caused by human actions like burning fossil fuels	['NoisySentence', 'NoisySentence', 'Relation']	NoisySentence
187	because carbon dioxide is the most emitted green house gas by human activity and because carbon dioxide remains in the atmosphere	['NoRelation', 'NoisySentence', 'NoRelation']	NoRelation
190	the blame of global warming on carbon dioxide is the most widely and most abundantly emitted green house gas of human activity	['Relation', 'NoRelation', 'NoisySentence']	NoAgreement
194	humans produce methane	['Relation', 'Relation', 'Relation']	Relation
195	humans produce , while think of the net effect , the most co2	['Relation', 'Relation', 'Relation']	Relation
197	humans our have increased the amount of carbon	['Relation', 'Relation', 'Relation']	Relation
201	suggests that since the industrial revolution when co2 emissions from human activity started , plants have been enjoying greatly increased usage of photosynthesis	['Relation', 'NoRelation', 'NoisySentence']	NoAgreement
211	humans produce very little emissions	['Relation', 'Relation', 'Relation']	Relation
216	the average human in a developed country such as the uk will produce metric tonnes of co2 waste per year	['NoRelation', 'Relation', 'Relation']	Relation
218	greenhouse gases were produced by human activities such as the burning of fossil fuels and deforestation	['Relation', 'Relation', 'Relation']	Relation
219	greenhouse gases were produced by human activities such as deforestation	['Relation', 'Relation', 'Relation']	Relation
220	humans put out at least 90 times more co2	['Relation', 'Relation', 'Relation']	Relation
223	greenhouse gases were produced by human activities	['Relation', 'Relation', 'Relation']	Relation
226	if this is not enough , then the opponent would be satisfied in knowing that humans also release an excessive quantity of methane ; albeit methane does not linger as long as co2 , methane short term effects on the environment are devastating	['Relation', 'Relation', 'Relation']	Relation
227	humans pump tons of co2	['Relation', 'Relation', 'Relation']	Relation
233	about 3/4 of human made carbon dioxide emissions were from burning fossil fuels	['Relation', 'Relation', 'Relation']	Relation
242	a greenhouse effect can eventually make the human race extinct	['Relation', 'Relation', 'Relation']	Relation
252	the harmful emissions are hazardous to humans	['Relation', 'NoRelation', 'NoRelation']	NoRelation
258	climate change am assuming that climate change will be arguing that humans are a major cause to global warming increases with c02 first point , is that c02 emissions are scientifically proven to be a mjor leading cause in the rise of global climate changes	['Relation', 'Relation', 'Relation']	Relation
270	the holocene period was not hot because of human co2 emissions	['NoRelation', 'NoRelation', 'NoRelation']	NoRelation
278	solar activity from 1900 to 1950 raised the temperature of the the earth 's degrees at the effect of co2 emissions over that same period , humans were giving a range of values of 0 degrees c for the effect of that emission on the climate	['Relation', 'Relation', 'Relation']	Relation
282	the elevated levels especially of carbon dioxide and methane are directly related to human activities such as the deforestation of tropical forests	['NoRelation', 'Relation', 'Relation']	Relation
293	the greenhouse effect 's cause warmth , but whether the greenhouse effect 's human contributions cause the warming of the earth	['Relation', 'Relation', 'Relation']	Relation
294	human activities are altering the earth 's carbon cycle both by adding more co2 to the atmosphere and by influencing the ability of natural sinks to remove co2 from the atmosphere	['Relation', 'Relation', 'Relation']	Relation
298	human activities are now causing atmospheric concentrations of greenhouse gases including tropospheric ozone well above pre industrial levels	['Relation', 'Relation', 'Relation']	Relation
301	a human embryo can expell carbon dioxide	['Relation', 'NoRelation', 'NoRelation']	NoRelation
304	human activities are now causing atmospheric concentrations of greenhouse gases including methane well above pre industrial levels	['Relation', 'Relation', 'Relation']	Relation
307	at least some of the increasing co2 trend is due to humans	['Relation', 'Relation', 'NoisySentence']	Relation
312	human activities are now causing atmospheric concentrations of greenhouse gases including carbon dioxide well above pre industrial levels	['Relation', 'Relation', 'Relation']	Relation
319	humans are increasing co2 levels	['Relation', 'Relation', 'Relation']	Relation
321	humans contribute a very , very small amount of carbon	['Relation', 'Relation', 'Relation']	Relation
328	humans are destroying the main apparatus of co2 absorption	['Relation', 'Relation', 'Relation']	Relation
330	b ) human emissions and global warming	['NoRelation', 'NoRelation', 'NoRelation']	NoRelation
333	us believe that global warming is being sped up by human activity and an excessive concentration of greenhouse gases	['Relation', 'Relation', 'Relation']	Relation
335	( state of fear harpercollinspublishers ) the conclusion that global warming is mainly caused by human activity and will continue if greenhouse gas emissions are not reduced has been endorsed by at least 30 scientific societies	['Relation', 'Relation', 'Relation']	Relation
341	volcano produce co2 more than humans	['Relation', 'Relation', 'Relation']	Relation
346	( repost ) 2 ) many of the many articles and papers , found by the science magazine , assert that humans are the main cause of the sudden increase in co2 levels , and therefore causing global warming	['Relation', 'Relation', 'Relation']	Relation
350	humans are increasing the levels of carbon in the atmosphere 4	['Relation', 'Relation', 'Relation']	Relation
353	( state of fear harpercollinspublishers ) the conclusion that global warming is mainly caused by human activity and will continue if greenhouse gas emissions are not reduced has been endorsed by academies of science	['Relation', 'NoRelation', 'Relation']	Relation
356	i will attempt to prove that the reason for an abundance of greenhouse gases in as a result increased global temperatures is a result of human actions	['NoisySentence', 'Relation', 'Relation']	Relation
361	i will attempt to prove that the reason for an abundance of greenhouse gases in the atmosphere increased global temperatures is a result of human actions	['Relation', 'NoRelation', 'Relation']	Relation
362	i will attempt to prove that the reason for an abundance of greenhouse gases in too much heat increased global temperatures is a result of human actions	['NoisySentence', 'NoisySentence', 'NoisySentence']	NoisySentence
364	humanity 's makes up approximately 3 % carbon dioxide gasses	['Relation', 'Relation', 'Relation']	Relation
372	laws are passed to reduce human green house gas emissions	['Relation', 'Relation', 'Relation']	Relation
374	humans have increased the amount of carbon dioxide	['Relation', 'Relation', 'Relation']	Relation
384	humans are able to create efficient carbon filters to decrease the amount of pollution	['Relation', 'Relation', 'Relation']	Relation
386	i will attempt to prove that the reason for an abundance of greenhouse gases in especially carbon dioxide increased global temperatures is a result of human actions	['NoRelation', 'Relation', 'Relation']	Relation
390	less than 2/1 ,000 of all co2 is produced by human activity more stuff	['Relation', 'Relation', 'Relation']	Relation
392	humans also give off many other emissions	['Relation', 'Relation', 'NoRelation']	Relation
398	humans are the greatest contributers to co2 output	['Relation', 'Relation', 'Relation']	Relation
399	manure storage systems represent a concern to air quality due to the potential impacts of methane on environmental quality , human health , and wellbeing swine	['Relation', 'Relation', 'Relation']	Relation
408	humans are responsible for much of co2 generation	['Relation', 'Relation', 'Relation']	Relation
418	cooling are caused by fluctuations in the sun 's heat ( solar forcing ) , not by the minor greenhouse effect of human produced gases such as co2 and methane	['Relation', 'Relation', 'Relation']	Relation
419	cooling down the earth 's by reducing the co2 emissions is a false statement because the earth 's will continue to heat via the earth 's natural cycles which we as humans would be wrong to alter	['NoisySentence', 'NoisySentence', 'NoisySentence']	NoisySentence
435	( 5 ) secondly are human emissions of carbon dioxide	['NoRelation', 'NoRelation', 'NoRelation']	NoRelation
474	humans are producing 30 billion tons of co2 a year	['Relation', 'Relation', 'Relation']	Relation
481	human emissions relate to increases in the co2 level	['Relation', 'Relation', 'Relation']	Relation
484	human emissions of greenhouse gases are expected instead to quadruple in the next hundred years	['NoRelation', 'NoRelation', 'NoRelation']	NoRelation
495	all the co2 was emitted by humans in the course of a year	['Relation', 'NoRelation', 'NoRelation']	NoRelation
523	co2 is emitted by humans	['Relation', 'Relation', 'Relation']	Relation
534	there is no convincing scientific evidence that human release of methane is causing or will cause catastrophic heating of the earth 's atmosphere and disruption of the earth the oregon petition states	['NoRelation', 'Relation', 'NoRelation']	NoRelation
538	humans have increased the concentration of that carbon dioxide a heat trapping green house gas	['Relation', 'Relation', 'Relation']	Relation
541	raising animals humanely can use less feed reducing costs and improving the soil greenhouse gas emissions are often reduced when animals are healthy and have good welfare	['Relation', 'Relation', 'Relation']	Relation
542	these emissions account for damaging human lungs	['Relation', 'Relation', 'Relation']	Relation
557	in conclusion , co2 is emitted by humans ''	['Relation', 'Relation', 'Relation']	Relation
563	human produced co2 is warming the earth , not natural co2 released from the ocean and other carbon sinks ''	['Relation', 'Relation', 'Relation']	Relation
570	humans do contribute to methane in the atmosphere	['Relation', 'Relation', 'Relation']	Relation
576	human related emissions are responsible for the increase ''	['NoisySentence', 'Relation', 'Relation']	Relation
582	1 ] , human co2 accounts for about 3 % to 8 % of the human effect on global warming	['Relation', 'Relation', 'Relation']	Relation
591	human sources of co2 amount to just 3 % of natural emissions	['NoRelation', 'NoRelation', 'NoRelation']	NoRelation
592	further independent evidence that humans are raising co2 levels comes from measurements of carbon	['Relation', 'Relation', 'Relation']	Relation
593	gas greenhouse effect human effectwater vapor % % carbon dioxide % % methane % nitrous oxide % % misc % % total 100 % %	['NoisySentence', 'NoisySentence', 'NoisySentence']	NoisySentence
594	this unprecedented increase in atmospheric carbon dioxide can be attributed almost entirely to human activity	['Relation', 'NoRelation', 'Relation']	Relation
595	human releases of co2 can not cause climate change	['NoRelation', 'NoRelation', 'NoRelation']	NoRelation
600	this means that carbon dioxide is causing global warming and that carbon dioxide is once again human beings fault due to the fact that we are the ones	['Relation', 'Relation', 'Relation']	Relation
606	humans do increase the concentration of co2	['Relation', 'Relation', 'Relation']	Relation
615	this is to show humans make most of atmospheric co2	['Relation', 'Relation', 'NoRelation']	Relation
627	greenhouse gas forcing has been the dominant cause of the observed global warming over the past 50 years	['Relation', 'Relation', 'Relation']	Relation
628	carbon dioxide emissions therefore are the most important cause of global warming	['Relation', 'Relation', 'Relation']	Relation
629	proof of co2 caused global warming	['Relation', 'Relation', 'NoRelation']	Relation
646	greenhouse gases are proven to be the largest contributor to global warming	['Relation', 'Relation', 'Relation']	Relation
649	greenhouse gas increases explain most of the global warming	['Relation', 'Relation', 'Relation']	Relation
653	greenhouse gases are required to promote the natural occurence of global warming	['Relation', 'Relation', 'Relation']	Relation
655	globally in phase warming was driven by increasing co2 concentrations	['Relation', 'Relation', 'Relation']	Relation
656	plants with improved nitrous fixation are forming , which has 296 times the impact of co2 on global warming and lasts much longer in the atmosphere , as well as impacting rivers , lakes and oceans	['Relation', 'NoRelation', 'NoRelation']	NoRelation
666	methane gas makes up 7 % of green house gasses responsible for global warming	['Relation', 'Relation', 'Relation']	Relation
675	all co2 preceded global warming at the end of the ice age	['NoRelation', 'NoRelation', 'NoRelation']	NoRelation
682	methane and nitrous oxide are major contributors to global warming	['Relation', 'Relation', 'Relation']	Relation
683	all plans to cut future emissions will not help actually reverse the current trajectory of global warming	['Relation', 'NoRelation', 'NoRelation']	NoRelation
695	although fluorinated gasesaccounted for only 2 percent of all greenhouse gas emissions in 2008 , only 2 percent of all greenhouse gas emissions areimportant because only 2 percent of all greenhouse gas emissions have extremely high global warming potential values andlong atmospheric because of reduced emissionsfrom landfills and coal mines , declined by 1 percent	['NoisySentence', 'NoisySentence', 'NoisySentence']	NoisySentence
703	just how much the total greenhouse effect affects global warming	['NoRelation', 'Relation', 'NoRelation']	NoRelation
705	all the main solutions to global warming entail cutting greenhouse gas emissions	['Relation', 'Relation', 'NoRelation']	Relation
715	other factors besides atmospheric carbon influence global warming	['Relation', 'NoRelation', 'NoisySentence']	NoAgreement
719	half of global warming were due to co2	['Relation', 'Relation', 'Relation']	Relation
728	percentage of global warming is caused by co2 gases even ballpark	['Relation', 'NoRelation', 'Relation']	Relation
730	percentage of global warming is caused by co2 my explained how	['NoisySentence', 'Relation', 'Relation']	Relation
739	no facts link the concentrations of atmospheric carbon dioxide with imminent and catastrophic global warming	['NoRelation', 'NoRelation', 'NoisySentence']	NoRelation
745	not to mention that methane from cow flatulence partially contributes to global warming	['Relation', 'Relation', 'Relation']	Relation
747	now ) my opponent then states that co2 essentially acts as an amplifier for the global warming effects making the effects even worse	['NoisySentence', 'NoRelation', 'Relation']	NoAgreement
766	co2 is the driving factor behind global warming	['Relation', 'Relation', 'Relation']	Relation
768	co2 is still one of the main causes of global warming	['Relation', 'NoisySentence', 'Relation']	Relation
772	therefore co2 must cause global warming today	['Relation', 'Relation', 'Relation']	Relation
776	co2 is directly responsible for global warming today	['Relation', 'Relation', 'Relation']	Relation
783	this is to stop global warming our need to lower ours ' greenhouse gas emissions by 80 % and to do this our need to have new laws and restrictions along with just day to day tasks to help stop global warming	['NoRelation', 'Relation', 'NoRelation']	NoRelation
794	this is for tougher emission standards and it has the potential for a great impact on the environment or slow down global warming 5	['Relation', 'NoRelation', 'NoRelation']	NoRelation
807	co2 is 9 to 26 % of global warming	['NoRelation', 'Relation', 'NoRelation']	NoRelation
824	i will prove the affects of global warming and co2	['NoRelation', 'NoisySentence', 'NoRelation']	NoRelation
825	a bill has been created to combat global warming and to lower the dangerous levels of co2	['Relation', 'Relation', 'Relation']	Relation
827	the total anthropogenic carbon dioxide emission is one of the largest contributors of global warming or climate change	['Relation', 'Relation', 'Relation']	Relation
844	[ source : then , to go back and compare the temperature since the industrial revolution to before the industrial revolution [ source : you can see industry ( made by man ) is a huge contribution to global warming , and polluting of co2	['Relation', 'Relation', 'Relation']	Relation
852	a ) global warming myth ( by carter ) in response to he 's greenhouse gases	['NoRelation', 'NoRelation', 'NoRelation']	NoRelation
856	this is to the grid to reduce their emission rates and slow down global warming something	['NoisySentence', 'Relation', 'NoRelation']	NoAgreement
858	coal is a major environmental hazard both on the local level and on the global level in the context of global warming ( coal is one of the worst greenhouse gas emitters )	['NoRelation', 'NoisySentence', 'Relation']	NoAgreement
864	what me can and have proven is that co2 and other ghgs have been a factor in the majority of climate shifts , and that modern global warming can be explained only by the increase of atmospheric co2 due to anthropogenic , let 's examine	['NoisySentence', 'NoisySentence', 'NoisySentence']	NoisySentence
865	what is unproved and unlikely is the claim that 75 % or more of global warming is due to anthropogenic co2	['NoRelation', 'NoisySentence', 'NoRelation']	NoRelation
866	electric cars is very important to lowering emissions and fighting global warming	['Relation', 'Relation', 'Relation']	Relation
876	we all agree that more greenhouse gases will make the earth also agree that trying to stop global warming will damage the leaves one question for you the judge to determine	['NoisySentence', 'NoRelation', 'NoRelation']	NoRelation
880	even if we did that , it would have almost no effect on global warming , because the us currently produces only 18 % of the total co2 , and that percentage is dropping rapidly as the developing world consumes more energy	['NoRelation', 'NoRelation', 'NoRelation']	NoRelation
885	contrary to popular belief even if we were to reduce or emissions completely and started a massive carbon capture program , we would still not be able to escape global warming 's effects	['NoisySentence', 'NoRelation', 'NoisySentence']	NoisySentence
896	the theory of global warming assumes that co2 is an atmospheric greenhouse gas and as co2 increases temperatures rise	['Relation', 'Relation', 'Relation']	Relation
900	yes , our factory emissions are accelerating global warming	['Relation', 'Relation', 'Relation']	Relation
902	yes , our car emissions are accelerating global warming	['Relation', 'Relation', 'Relation']	Relation
903	definitions : co2 theory : greenhouse effect false : not real case : temperature record one central problem for those who promote the idea of man made global warming is the earth 's temperature record on almost all time scales	['NoisySentence', 'NoRelation', 'NoRelation']	NoRelation
907	doesnt cremation increase our carbon footprint or increase global warming ( i am aware that global warming is just a theory )	['Relation', 'Relation', 'Relation']	Relation
915	this was to be about man made global warming , so i 'll show why my opponent 's logic is flawed here too ) i have proven that co2 does absorb heat , thus keeping in the earth and heating the earth ) co2 levels have fluctuated in the past naturally , brought about by things such as an increase in volcanic activity	['Relation', 'Relation', 'Relation']	Relation
928	this phenomenon global warming are convinced that the earth will simply get too hot if something is n't done to stop the build up of carbon dioxide	['Relation', 'Relation', 'Relation']	Relation
930	this methane is responsible for nearly as much global warming	['Relation', 'Relation', 'Relation']	Relation
