Input.Number	Input.Sentence	Answer.detect	Answer.detect_agg
4947	there are so many other measures setup surveillance cameras ( even dummy cams ) to deter theives , video footage is proof of theft	['Relation', 'Relation', 'Relation']	Relation
4954	b : the fewer cameras there are , the higher chance of crime happening	['Relation', 'Relation', 'Relation']	Relation
4959	not only would these unsolved problems be solved , but these unsolved problems would discourage individuals from committing crimes when individuals feel individuals have a regulated sense of accountability and punishment for illegal or adverse 've fulfilled the framework by showing tangible benefits by preserving surveillance	['Relation', 'Relation', 'Relation']	Relation
4963	cameras will not stop crime altogether	['NoRelation', 'NoRelation', 'NoRelation']	NoRelation
4966	the monitoring methods have shown a marked decrease in crime	['Relation', 'Relation', 'Relation']	Relation
4982	just take surveillance cameras and all the crimes surveillance cameras prevent	['Relation', 'Relation', 'Relation']	Relation
4988	crime cameras are useful in fighting illegal activity	['Relation', 'Relation', 'Relation']	Relation
4998	crime cameras capture a crime	['NoRelation', 'NoRelation', 'Relation']	NoRelation
5003	an increase in high tech tools such as cameras was a big reason why violent crimes nationwide decreased in 2010	['Relation', 'Relation', 'Relation']	Relation
5014	cameras make a small but valuable contribution to crime fighting	['Relation', 'Relation', 'Relation']	Relation
5015	cameras do n't always keep criminals off	['NoRelation', 'NoRelation', 'NoRelation']	NoRelation
5023	his only idea to stop illegal immigration would be to build a wall and deport illegals	['NoRelation', 'Relation', 'Relation']	Relation
5026	4 ) does the border fence deter immigration or just illegal immigration	['NoisySentence', 'NoRelation', 'NoRelation']	NoRelation
5044	a border fence has all but eliminated illegal immigration	['Relation', 'Relation', 'Relation']	Relation
5047	pass nopec crack down on china 's currency manipulation by calculating taxes on imports based on how much a manufacturing country 's currency is undervalued spur job and wealth creation through a 5 point tax plan finish the border fence , boot out criminal illegals , and america 's immigration system	['NoisySentence', 'NoRelation', 'Relation']	NoAgreement
5053	immigration policy will act as a deterrent to illegal immigration while putting up a border fence thereby securing the us mexico border	['Relation', 'Relation', 'Relation']	Relation
5057	a border wall were to be implemented , cutting illegal immigration down by approximately half [ 4 ]	['Relation', 'Relation', 'Relation']	Relation
5061	all of that said while i will agree that a border wall would prevent some illegal immigrants from entering the country , enforcing the people with expired visas and investing in more border patrol agents would be a better solution	['NoisySentence', 'Relation', 'Relation']	Relation
5064	the direct effects of a border fence will be less illegal immigration which as i posted earlier means a smaller economy	['Relation', 'NoisySentence', 'Relation']	Relation
5076	the wall is no more illegal immigrants	['NoRelation', 'NoRelation', 'NoisySentence']	NoRelation
5090	esteban flores of harvard international review unwittingly reinforces trump s argument that a wall is necessary , though not sufficient , to boost border security and hinder illegal immigration	['Relation', 'Relation', 'Relation']	Relation
5093	illegal immigrants are holding steadfast that the border fence in texas will magically stop aliens from coming to america because quite frankly other alternatives	['Relation', 'NoisySentence', 'Relation']	Relation
5098	beasley school of law ) , 2005 , national security , the complete border fence is the essential element in any plan to limit illegal immigration across the southern border	['Relation', 'Relation', 'Relation']	Relation
5099	beasley school of law ) , 2005 , immigration , the complete border fence is the essential element in any plan to limit illegal immigration across the southern border	['Relation', 'Relation', 'Relation']	Relation
5106	the direct effects of a border fence will be less illegal immigration which as i posted earlier means less revenue	['Relation', 'Relation', 'Relation']	Relation
5107	the us mexico border fence has : reduced illegal immigration rates helped defend the economy of the united states reduced the influx of drugs and crime across the border strengthened national security maintained american sovereignty and bordersalthough there are objections to the border fence , they are mostly based on weak evidence	['Relation', 'Relation', 'Relation']	Relation
5110	we put up a border fence to protect american 's from american 's , and to stop illegal immigration	['Relation', 'Relation', 'Relation']	Relation
5111	even if a wall does not stop illegal immigration all together , even stopping some of a wall does make a wall effective	['NoisySentence', 'NoRelation', 'Relation']	NoAgreement
5112	the wall is a necessary action to curtail illegal immigration , to reduce the burden on the taxpayer for illegals welfare benefits , and to prevent future increased crime rates	['Relation', 'Relation', 'Relation']	Relation
5116	how would the wall in israel suddenly stop illegal immigrants the people getting all illegal immigrants across make a killing off of this and will find a way to get through	['NoRelation', 'NoRelation', 'NoRelation']	NoRelation
5121	brian moore even goes further by giving sanctuary to illegal immigrants in the not with walls or guns or threats of imprisonment , but with fairer policies toward all other countries to enable all other countriess ' economies to thrive and expand as well	['NoRelation', 'Relation', 'NoisySentence']	NoAgreement
5122	brian moore even goes further by giving sanctuary to illegal immigrants in impact immigration influx not with walls or guns or threats of imprisonment , but with fairer policies toward all other countries to enable all other countriess ' economies to thrive and expand as well	['Relation', 'Relation', 'NoRelation']	Relation
5123	this wall has stopped all illegal immigration , benjamin netanyahu boasts	['Relation', 'Relation', 'Relation']	Relation
5140	a boarder wall would not stop illegal immigration a waste	['Relation', 'NoRelation', 'NoRelation']	NoRelation
5148	building a fence is shown to reduce illegal contraband and immigration , so that border security personnel can then focus on the 5 % that the fence does n't deter	['Relation', 'Relation', 'Relation']	Relation
5150	[ [ response to pro 's arguments ] ] p1 : a border fence would stop all illegal immigrants coming from central and south america , also stopping went on to violate the terms of their admission	['Relation', 'Relation', 'NoRelation']	Relation
5161	a wall wo n't stop all illegal immigrants come in on legal visas	['NoRelation', 'NoRelation', 'NoRelation']	NoRelation
5168	the border wall still would n't stop the other 50 60 % of illegal immigrants	['NoRelation', 'NoRelation', 'Relation']	NoRelation
5170	this was what [ [ response to pro 's arguments ] ] p1 : a border fence would stop all illegal immigrants coming from central and south america , also stopping has been estimated	['NoRelation', 'Relation', 'Relation']	Relation
5172	a wall would have cut this number in half if implemented not too long ago , considering approximately half of all illegal immigrants in the us hopping the border	['Relation', 'NoisySentence', 'Relation']	Relation
5176	a far larger number of innocent people would end up dead from the cartel violence then without the border wall ) illegal immigrants may pay income taxes the wall	['Relation', 'Relation', 'Relation']	Relation
5178	a wall stopped half of illegal immigration	['Relation', 'Relation', 'Relation']	Relation
5185	9 ] means a wall to keep illegal immigrants at bay	['NoRelation', 'NoRelation', 'NoRelation']	NoRelation
5187	a border fence 's a logical component in combating illegal immigration , drug and arms smuggling , and denying access to terrorists	['Relation', 'Relation', 'Relation']	Relation
5202	you think legalizing the drug is going to stop theft to stop buying from dealers	['Relation', 'Relation', 'NoRelation']	Relation
5210	then we can curb the bad sides to prostitution just like how legalizing drugs will curb the crime	['Relation', 'Relation', 'Relation']	Relation
5222	legalizing drugs in america will not stop street gangs	['NoRelation', 'Relation', 'NoRelation']	NoRelation
5225	career criminals will not stop the people committing violent crimess ' illegal activities once drugs are legalized	['NoRelation', 'NoRelation', 'NoisySentence']	NoRelation
5231	legalization does three things legalization removes all the criminal penalties ( or at least limit how often people use people ) , legalization allows for drugs	['Relation', 'NoRelation', 'Relation']	Relation
5234	portugal legalized the drugs and portugal saw a substantial drop in all crimes , portugals ' economy began to improve from the money	['Relation', 'Relation', 'Relation']	Relation
5236	there are several reasons why drugs need to be legalized and regulated ) society will benefit from less crimes related to the illegal drug trade )	['Relation', 'Relation', 'Relation']	Relation
5241	there are roughly 2,100,000 with criminal convictions ( excluding the obvious one of illegal immigration ) legalizing drugs such as marijuana would hit the cartel where the prohibition hurts	['Relation', 'Relation', 'Relation']	Relation
5242	this is out of the hands of criminals , instead of harassing teens for drug use ( in legalize drugs 'll get rid of half of the guns )	['NoRelation', 'NoisySentence', 'NoRelation']	NoRelation
5253	drug legalization would increase crime drug legalization is commonly argued legalization would reduce crime , but that is illogical	['Relation', 'NoisySentence', 'NoisySentence']	NoisySentence
5264	legalizing drug use would in no way decrease crime rate	['NoRelation', 'Relation', 'NoRelation']	NoRelation
5265	should we make illegal drugs legal , we could effectively cut gang sizes	['Relation', 'Relation', 'Relation']	Relation
5286	contention 3 : legalizing marijuana would reduce drug related crime rates	['Relation', 'Relation', 'Relation']	Relation
5297	to quote from above , the neighborhoods surrounding the legalized drug area experienced increase crime and violence	['Relation', 'Relation', 'Relation']	Relation
5303	price drug addicts often how to commit crime to get money for price drug addictss ' but if drugs were legalized the prices would go down	['NoisySentence', 'Relation', 'NoRelation']	NoAgreement
5308	essential liberty lets drugs be legal , while something else criminalizes the use	['Relation', 'NoRelation', 'Relation']	Relation
5319	no evidence legalizing drugs will reduce these crimes	['NoRelation', 'Relation', 'NoRelation']	NoRelation
5320	if drug trading becomes legal theft and blackmail will fall to very low levels or will almost disappear	['NoisySentence', 'Relation', 'Relation']	Relation
5348	marijuana ought to be legalized to help treat those afflicted with diseases : legalizing marijuana would reduce drug related crime , the government would no longer need to arrest all marijuana dealers , only the unlicensed ones	['Relation', 'Relation', 'Relation']	Relation
5358	illegal immigrants can be benificial for the economy in the long run	['Relation', 'Relation', 'Relation']	Relation
5360	those immigrants have directly contributed to ours ' economy	['Relation', 'NoisySentence', 'Relation']	Relation
5361	illegal immigrants have a neutral to slightly beneficial effect on the economy	['Relation', 'Relation', 'Relation']	Relation
5372	we have this idea that the irish immigrants ( caused by the potato famine ) in the diminish the quality of out country or economy	['NoisySentence', 'NoisySentence', 'NoisySentence']	NoisySentence
5373	illegal immigrants have contributed handily to our economy	['Relation', 'Relation', 'Relation']	Relation
5374	illegal immigrants could be a major contributer to the economy	['Relation', 'Relation', 'Relation']	Relation
5378	those immigrants were sapping salaries away from the civilian economy	['Relation', 'Relation', 'Relation']	Relation
5380	advantage 1 : immigrants are essential to wes ' economy	['Relation', 'Relation', 'NoRelation']	Relation
5385	immigrants come to contribute to the economy	['Relation', 'Relation', 'Relation']	Relation
5390	pro says in r3 : so long as the us has a better economy [ than mexico ] , people will seek to migrate	['NoRelation', 'Relation', 'NoRelation']	NoRelation
5392	to further complicate the situationwe have to worry about the crippling effects of an already struggling economy plus a significant illegal immigration problem	['NoRelation', 'NoRelation', 'NoRelation']	NoRelation
5403	even the worst economy in 70 years has only slowed , the growth in migration	['Relation', 'Relation', 'NoRelation']	Relation
5408	one , people who immigrate to other countries come from even worse conditions in people who immigrate to other countriess ' home country , which most likely has a socialist economy with a repressive government	['NoRelation', 'NoRelation', 'NoRelation']	NoRelation
5409	to prevent people was the american economy 's strength lies in the power of immigrants	['NoRelation', 'NoisySentence', 'NoisySentence']	NoisySentence
5413	on the contrary , immigrants actually help the united states economy ; immigrants provide a cheap source of labor	['Relation', 'Relation', 'NoisySentence']	Relation
5419	immigrant workers would support the economy	['Relation', 'Relation', 'Relation']	Relation
5426	whether the reason for immigrating to the united states is to contribute to the economy	['NoRelation', 'NoRelation', 'NoRelation']	NoRelation
5427	conclusion illegal immigrants are a drain on wes ' economy by avoiding taxes and getting free welfare	['Relation', 'Relation', 'NoisySentence']	Relation
5429	the other ' invisible turkey , where there are major economic problems , such as unemployment , low wages , bad infrastructure and high immigration rates may have a growing economy	['NoRelation', 'NoRelation', 'NoRelation']	NoRelation
5433	immigrants bring crime & harm the economy there is no evidence to support these claims & a great deal of evidence to the : document ) website ) website )	['NoRelation', 'Relation', 'Relation']	Relation
5435	empirically however , immigrants only help a countries economy	['Relation', 'Relation', 'Relation']	Relation
5444	immigrants are contributing to the economy	['Relation', 'Relation', 'Relation']	Relation
5448	immigrants stealing our jobs barely can help wes ' economy too	['NoisySentence', 'NoRelation', 'NoisySentence']	NoisySentence
5462	in no way do illegal immigrants help the the united states economy ; illegal immigrants are just hurting the nation and tax paying citizens	['Relation', 'Relation', 'Relation']	Relation
5473	illegal immigrants will be putting illegal immigrantss ' money back into our economy	['NoisySentence', 'NoisySentence', 'Relation']	NoisySentence
5474	illegal immigrants are hurtful to the economy	['Relation', 'NoisySentence', 'NoisySentence']	NoisySentence
5475	severe water shortages would be a massive hit to their expat ( basically , immigrants ) based economy since nobody will be willing to live in the place	['Relation', 'NoRelation', 'Relation']	Relation
5479	according to the state and local tax data analysis published by the institute on taxation and economic policy ( itep ) undocumented immigrants contribute about $ billion to the economy annually , including nearly $ 7 billion in sales and excise taxes and $ billion in property taxes	['Relation', 'Relation', 'NoRelation']	Relation
5499	illegal immigration has a negative effect on the economy	['Relation', 'Relation', 'Relation']	Relation
5506	economy ( more on gdp ) undocumented immigrants	['NoRelation', 'NoRelation', 'NoRelation']	NoRelation
5507	illegal immigration has on ours ' economy	['NoRelation', 'NoRelation', 'NoRelation']	NoRelation
5514	low skilled immigrants are willing to do work that many americans won say that especially with unemployment at the growth of the workforce slowing , immigrants skilled as well as unskilled are vital to the economy	['NoisySentence', 'NoRelation', 'NoisySentence']	NoisySentence
5516	bad economy , large migrating populations flowing in and out of major countries like america looking for work or to settle down	['NoRelation', 'NoisySentence', 'NoRelation']	NoRelation
5521	the drain on the economy to refer to the unpaid use of services such as emergency medical care and to the effects illegal immigration has on the availability of jobs	['Relation', 'NoRelation', 'Relation']	Relation
5524	well as this the money that the illegal immigrants in the country contribute to the us economy comes from not the illegal immigrants in the country	['NoisySentence', 'NoisySentence', 'NoRelation']	NoisySentence
5540	it allows immigrants to prosper in there own economy	['NoRelation', 'Relation', 'NoRelation']	NoRelation
5541	the economy was offset by the benefits of legal immigration	['NoRelation', 'Relation', 'NoRelation']	NoRelation
5551	this is just one scenario where immigrants make a positive impact on the american economy	['Relation', 'Relation', 'Relation']	Relation
5563	[ 9 and roughly 675,000 immigrants each year place on the society to which roughly 675,000 immigrants each year assimilate , the economy is also adversely affected by immigration	['Relation', 'Relation', 'NoisySentence']	Relation
5569	wes ' economy is loosening rules for our immigration	['Relation', 'Relation', 'Relation']	Relation
5572	the current state of immigration is evidence of uss ' faltering economy	['Relation', 'Relation', 'NoisySentence']	Relation
5576	the conservatives however brought the economy back from the ruins of limited immigration	['Relation', 'Relation', 'NoRelation']	Relation
5578	an immigration invasion is leaders of economies throughout the world	['NoRelation', 'NoRelation', 'NoRelation']	NoRelation
5580	more restrictive migration laws introduced by arizona have not benefitted the swedish economy	['NoRelation', 'NoRelation', 'NoisySentence']	NoRelation
5585	this is not right or should this ever be ) economy weakens if ours ' gives money to illegal immigrants who do n't pay taxes ( one way economy makes money off of we ) and then sends more of their money to family back home in a different economy our lose money	['Relation', 'NoRelation', 'Relation']	Relation
5607	legal immigration is positvely effects the economy	['Relation', 'Relation', 'Relation']	Relation
5609	somehow i do n't think having an immigrant send forty bucks back to mexico for your family helps america as much as putting a hundred dollars into the local economy would	['NoRelation', 'NoRelation', 'NoRelation']	NoRelation
5613	the illegal immigrants hurt wes ' economy	['Relation', 'Relation', 'Relation']	Relation
5619	i look forward to citing current open borders within the pacific ocean to further dispel pro 's xenophobic fear that immigrants will harm the us economy	['Relation', 'NoRelation', 'Relation']	Relation
5620	: : contention 3 : : > my third contention is that a lack of the illegal immigrants in fact would devastate the us economy	['Relation', 'Relation', 'Relation']	Relation
5621	so why spend millions of dollars preventing these current mexican immigrants , who are in every way equivalent from reinforcing wes ' economy	['Relation', 'NoRelation', 'NoisySentence']	NoAgreement
5622	the taxes ( most of which immigrants don t even receive ) that have drained the economy dry ''	['Relation', 'Relation', 'Relation']	Relation
5630	all undocumented immigrants contribute to our economy , all undocumented immigrants account for 5 percent of the total labor force	['Relation', 'Relation', 'Relation']	Relation
5635	developing countries need to address the lack of opportunities in order to improve developing countriess ' economy and reduce migration	['Relation', 'Relation', 'Relation']	Relation
5650	so immigrants contribute to the us economy	['Relation', 'Relation', 'Relation']	Relation
5662	the 11 million illegal immigrants are taking away jobs from the us economy	['Relation', 'Relation', 'Relation']	Relation
5686	humans affect climate changes quickly	['Relation', 'NoRelation', 'NoisySentence']	NoAgreement
5702	human induced climate change is threatening an even bleaker future	['NoRelation', 'Relation', 'Relation']	Relation
5706	climate change is real and a massive threat to humanity	['Relation', 'Relation', 'NoRelation']	Relation
5707	the effects of climate change on humans is severe	['NoRelation', 'NoRelation', 'NoRelation']	NoRelation
5708	the most common effects of global climate change include more frequent wildfires ultimately infringing on the human values of safety and security	['Relation', 'Relation', 'Relation']	Relation
5732	climate changes based on the forces , the current forcing is humans	['NoRelation', 'NoRelation', 'NoisySentence']	NoRelation
5738	human activity is changing the climate , the atmosphere effects have severe , negative repercussions for everyone	['NoisySentence', 'NoisySentence', 'Relation']	NoisySentence
5750	what is more open to discussion , is whether the changing climate is due to human influence or if the changing climate some natural phenomenon	['NoRelation', 'Relation', 'NoRelation']	NoRelation
5752	there is also overwhelming scientific consensus climate change is being caused by human activity	['Relation', 'Relation', 'Relation']	Relation
5754	human history is now widely considered a serious threat due to associated environmental problems such as climate change , biodiversity loss , desertification , and ecosystem degradation ( ipcc ; epa network ; stern review ; millennium ecosystem assessment ; wuppertal institute ; wwf ; unep	['Relation', 'NoisySentence', 'NoRelation']	NoAgreement
5763	people like to say that humans are affecting the human made climate change and that earth is getting hotter , the un 's intergovernmental panel have had dinosaurs	['NoisySentence', 'NoRelation', 'Relation']	NoAgreement
5765	climate change is caused at least significantly by humans	['Relation', 'Relation', 'Relation']	Relation
5777	climate change is changing so fast humans	['NoRelation', 'Relation', 'NoRelation']	NoRelation
5786	i , and do certainly speed i have absolutely no doubt that natural causes do contribute to climate changes in a sense up , but they are not as pronounced as human changes	['NoRelation', 'Relation', 'Relation']	Relation
5802	impoverished , whole species ( including humanity ) could get wiped out from climate change	['Relation', 'Relation', 'Relation']	Relation
5806	modern climate change is due to humans	['Relation', 'Relation', 'Relation']	Relation
5810	humans do not cause climate change	['NoRelation', 'NoRelation', 'NoRelation']	NoRelation
5821	humans making climate change	['Relation', 'Relation', 'Relation']	Relation
5822	the scientific consensus on climate change 's primarily human caused	['NoRelation', 'Relation', 'Relation']	Relation
5829	the us national climate assessment 's declaration of human caused climate change	['Relation', 'Relation', 'Relation']	Relation
5834	moral rules might be challenged by environmental change , particularly as humans migrated to different terrain and climates	['NoRelation', 'Relation', 'NoRelation']	NoRelation
5836	states , the main source of global climate change is human induced changes in atmospheric composition ''	['NoisySentence', 'NoisySentence', 'NoisySentence']	NoisySentence
5846	if humans started climate change	['NoRelation', 'NoisySentence', 'NoRelation']	NoRelation
5861	humans are impacting climate change	['Relation', 'Relation', 'Relation']	Relation
5871	humans are the cause of climate change first thing	['Relation', 'Relation', 'Relation']	Relation
5874	of course conditions for humans and other complex life will become impossible much sooner and this is being accelerated by anthropogenic climate change , says andrew rushby	['Relation', 'NoRelation', 'NoRelation']	NoRelation
5878	humans are the main contributors to climate change	['Relation', 'Relation', 'Relation']	Relation
5883	humans are the main creature that caused a big problems in climate changing and damage the panel during a short period of time	['Relation', 'Relation', 'Relation']	Relation
5884	humans can have a big enough impact to change the climate	['Relation', 'Relation', 'NoRelation']	Relation
5885	merely human was induced climate change	['NoisySentence', 'Relation', 'NoisySentence']	NoisySentence
5888	strong security council sanctions had succeeded in preventing saddam hussein from restarting iraq 's nuclear weapons program between the gulf war in 1991	['Relation', 'Relation', 'Relation']	Relation
5894	i is begin economic sanctions on the people 's republic of china or that if the people 's republic of china does not stand down , we back taiwan as wes ' ally , to prevent an imminent attack	['NoisySentence', 'Relation', 'NoisySentence']	NoisySentence
5899	strong security council sanctions had succeeded in preventing saddam hussein from restarting iraq 's nuclear weapons program between the coalition occupation of iraq 's in 2003	['Relation', 'Relation', 'Relation']	Relation
5906	i already pointed out above how the death penalty indirectly prevents suffering ) the death penalty provides relief for victims	['Relation', 'Relation', 'Relation']	Relation
5907	the effectiveness of the death penalty in order to prevent crime is the job of leading figures and politicians to underline the incompatibility of capital punishment with human dignity	['Relation', 'Relation', 'Relation']	Relation
