Input.Number	Input.Sentence	Answer.detect	Answer.detect_agg
7717	clearly the solution would be to help immigrants integrate into swedish society and thus hold a stake in immigrantss ' host country 's future prosperity and general wellbeing	['NoisySentence', 'NoRelation', 'NoRelation']	NoRelation
7740	many immigrantss ' adaptation to american society is very difficult for many immigrants	['NoRelation', 'NoRelation', 'NoRelation']	NoRelation
7741	extend my that we 'll have to stop focusing on serious crimes this means we 're deporting even the good immigrants that will be beneficial to wes ' society	['NoRelation', 'Relation', 'Relation']	Relation
7752	illegal immigrants are active members of american society	['NoRelation', 'NoRelation', 'NoRelation']	NoRelation
7753	a manifestation of a higher level of moral character will migrate through civil societies	['Relation', 'NoRelation', 'Relation']	Relation
7755	this was in society positive change , a living and evolving constitution , increased immigration and integration	['Relation', 'Relation', 'NoRelation']	Relation
7756	the anti illegal immigrant rhetoric permeates american society	['NoRelation', 'NoRelation', 'NoRelation']	NoRelation
7765	a serious part of the illegal immigrant problem is the lack of information on this group of american society	['NoRelation', 'NoRelation', 'NoRelation']	NoRelation
7768	illegal immigrants ( illegals ) invade the host society	['Relation', 'NoisySentence', 'NoRelation']	NoAgreement
7773	free immigration moves american society away from the libertarian ideal	['Relation', 'Relation', 'Relation']	Relation
7791	what kind of moral principals do you think polygamy would instill in children	['NoRelation', 'NoRelation', 'NoRelation']	NoRelation
7811	it 's interesting to note that among the reasons for practicing polygamy are it allows men to have more children '	['Relation', 'Relation', 'Relation']	Relation
7816	with polygamous marriages there as well as an increased cost placed upon employers and the government [ marriage is contrary to the purpose and societal goal of marriage , harms children and weakens the nuclear family	['NoisySentence', 'Relation', 'Relation']	Relation
7820	since polygamy is illegal children are under constant pressure of hiding these illegal wives and childrens ' relationships with these illegal wives and children	['NoRelation', 'NoisySentence', 'NoisySentence']	NoisySentence
7826	economies of scale would still mean that a father devoted only 10 % of his time to child rearing and this did n't change with polygamy and polyandry , economies of scale 'd do more parenting overall	['NoisySentence', 'NoRelation', 'NoRelation']	NoRelation
7837	that pornography is promotes rape etc	['Relation', 'Relation', 'Relation']	Relation
7838	c2 ) pornography should be censored c2 ) pornography increases the rape rate and abuse rate a meta analysis of all of the studies finds that pornography consumption increases violence rates	['Relation', 'Relation', 'Relation']	Relation
7841	conclusion legalizing child porn not only were being raped	['NoRelation', 'NoRelation', 'NoRelation']	NoRelation
7854	we know that in some countries pornography is forbidden and pornography leads to a higher index of rape , and nothing was observed on children , the christians just do n't care about pornografy , the christians will care	['Relation', 'Relation', 'Relation']	Relation
7865	the rapes occured after habitual consumption of child porn	['NoisySentence', 'NoRelation', 'Relation']	NoAgreement
7874	a decline in reported rape of 85 % in the past 25 years can be tied to an increase in pornography consumption	['Relation', 'Relation', 'Relation']	Relation
7877	[ 6 ] court of san diego university notes , in south australia recent mass murderers used pornography liberalized the pornography laws and saw a 284 % increase in rape	['Relation', 'Relation', 'Relation']	Relation
7878	rape has declined in the modern era , because of the increase of porn	['Relation', 'Relation', 'Relation']	Relation
7881	the states with the least internet access between 1980 and 2000 and therefore the least access to internet pornography experienced a 53 percent increase in rape incidence [ 6 ] so they	['Relation', 'Relation', 'Relation']	Relation
7891	[ 7 ] we can reduce the few times that sexual motivated rapes do occur if there are other outlets like pornography and prostitution	['Relation', 'Relation', 'Relation']	Relation
7895	my opponent 's implies that the increases to rape were as a result of the liberalization of pornography , but if my find even one scenario where pornography has n't necessarily caused an increase in sex crime rates , pornography implies	['Relation', 'Relation', 'Relation']	Relation
7903	should we round up those who view pornography for the / possibility / that those who view pornography for the / possibility will later rape	['Relation', 'NoRelation', 'NoRelation']	NoRelation
7908	violent porn apparently has the same power to increase rape proclivity	['Relation', 'Relation', 'Relation']	Relation
7914	though homosexual behavior is inherently destructive ' is a bit harsh because pornography is way worse at destruction : kid naps rape cases stalkers , et cetera	['NoRelation', 'Relation', 'NoRelation']	NoRelation
7935	child pornography was genuine rape videos for entertainment and killing sports arenas	['NoRelation', 'NoRelation', 'NoRelation']	NoRelation
7941	pornography experienced only a 23 % increase in rape	['Relation', 'Relation', 'NoisySentence']	Relation
7943	pornography is a direct cause of rape	['Relation', 'Relation', 'Relation']	Relation
7945	acting porn plays into the rape fantasy of many women	['Relation', 'Relation', 'Relation']	Relation
7963	the success of the international community and economy depends on successful states	['Relation', 'NoRelation', 'Relation']	Relation
7971	and should we not be focused on adaptation and change , rather than fuelling this thing we call an economy ' that results is disparity of wealth , environmental destruction and the breakdown of community values	['Relation', 'Relation', 'Relation']	Relation
7973	a command economy , or in layman s terms communism	['NoRelation', 'NoRelation', 'NoisySentence']	NoRelation
7979	the last spark of communism 's decline that their economy could not keep up with the times	['NoRelation', 'Relation', 'NoRelation']	NoRelation
7988	representatives have every incentive to ensure that the money goes into stimulating local economies , investing in neglected communities , and making a positive impact on the lives of millions of americans	['Relation', 'NoRelation', 'Relation']	Relation
7993	siege operates by restricting the economy of the entire community , creating shortages of food	['Relation', 'Relation', 'Relation']	Relation
7995	the marshall plan ( officially the european recovery program ) was the large scale american program to aid europe where the united states gave monetary support to help rebuild european economies after the end of world war ii in order to combat the spread of soviet communism ''	['Relation', 'Relation', 'Relation']	Relation
7998	this has effectively eliminated ours ' free market , creating a command economy s terms communism	['NoisySentence', 'NoRelation', 'NoisySentence']	NoisySentence
8003	stopping inflation was central not only to the health of the soviet union 's tottering economy , but to the defeat of communism as well	['Relation', 'Relation', 'Relation']	Relation
8005	a negative impact on the economy of the surrounding communities are lsb 1 ] additionally	['NoisySentence', 'NoRelation', 'NoisySentence']	NoisySentence
8006	stating that there is no economy in communism would mean there are no resources	['NoRelation', 'NoRelation', 'NoRelation']	NoRelation
8007	stalin will also note that following collectivization of agriculture and forced industrialization from 1927 , a soviet economy emerged based on communal agricultural work	['Relation', 'NoRelation', 'Relation']	Relation
8009	an illegal economy in poor communities are getting an education	['NoRelation', 'NoRelation', 'NoisySentence']	NoRelation
8025	the american economy would also occur under communism	['NoRelation', 'NoisySentence', 'NoRelation']	NoRelation
8031	the rentier economies rely upon systems of this patronage , merchant communities and patron client relationships , economic considerations become subservient	['NoRelation', 'NoRelation', 'NoRelation']	NoRelation
8034	globalism is the disassembling dispersing of the american economy to locations abroad , yielding enormous wealth and profits to the corporatocracy ( the corrupt and shady , behind the scenes cooperation of government and business ) while displacing much of the american workforce gutting ' their local economy and communities	['NoisySentence', 'Relation', 'Relation']	Relation
8065	there is no doubt that the iranian regime is now paying the price in economic terms of the iranian regime defiance of the international community , severe sanctions are having a deeply negative effect on the iranian economy ''	['Relation', 'Relation', 'NoisySentence']	Relation
8066	hud 's is working to strengthen the housing market to bolster the economy and protect consumers ; meet the need for quality affordable rental homes : utilize housing as a platform for improving quality of life ; build inclusive and sustainable communities free from discrimination ; and transform hud 's does business	['NoisySentence', 'Relation', 'NoRelation']	NoAgreement
8067	an illegal economy in poor communities advocates and promotes laziness	['Relation', 'Relation', 'Relation']	Relation
8072	also exports the cultural mentality of capitalism , including certain motivations , desires , and goals that have made the drive to globalized markets possible	['Relation', 'NoisySentence', 'Relation']	Relation
8094	i believe to be golden ages of achievement ; the development of agriculture , religion , writing , government , and eventual global interactions and spread of ideas from one culture to the next	['NoRelation', 'NoRelation', 'NoRelation']	NoRelation
8097	the squelching of culture and individual are the dark and overstated form of globalization	['NoisySentence', 'NoRelation', 'NoRelation']	NoRelation
8107	( 380 ) almost any act of negativity ' the refusal to work confrontations with the police are equally powerful forms of resistance because the construction of the empire , and the globalization of economic and cultural relationships , means that the virtual center of the empire can be attacked from any point '	['NoRelation', 'NoRelation', 'NoRelation']	NoRelation
8112	this is to achieve economic globalization to advance the cultures of indigenous peoples	['NoRelation', 'NoRelation', 'NoRelation']	NoRelation
8114	a combination of economic , cultural , and institutional ties from the united states , have contributed to an erosion of the global strategic position	['Relation', 'Relation', 'Relation']	Relation
8133	a global phenomenon is happening in nearly every culture group	['NoRelation', 'NoRelation', 'NoRelation']	NoRelation
8136	the us is furthering the us traditional role of being the primary engine of global economic growth	['NoRelation', 'NoisySentence', 'NoRelation']	NoRelation
8145	this was to defend their homeland from the nazi armiess ' culture for future generations and to avoid the global uniformity of the nazi party	['NoisySentence', 'NoRelation', 'NoRelation']	NoRelation
8147	traditions throughout history and dispersed globally denote the moral importance of charity , benevolence , and altruism to people in need	['NoRelation', 'NoRelation', 'NoRelation']	NoRelation
8150	globalization integration of cultures , goods , and ideas across national borders is a fundamentally good thing	['NoRelation', 'NoRelation', 'NoRelation']	NoRelation
8154	we damage their culture and damage global stability	['Relation', 'NoRelation', 'Relation']	Relation
8170	you get the real possibility of a global islamic cultural ) ; the religiosity of taoism and buddhism	['NoRelation', 'NoRelation', 'NoRelation']	NoRelation
8175	neo liberal globalization forms a capitalistic culture of fetish for self identifying commodities	['NoRelation', 'NoRelation', 'Relation']	NoRelation
8177	conflict is creating a global culture	['Relation', 'NoRelation', 'Relation']	Relation
8184	the second amendment protects an individual right to possess and carry firearms	['Relation', 'Relation', 'Relation']	Relation
8191	p2 : the reason legalization reduces the health problems associated with drug use is that drug users will have more access to medical treatment , since drug users do n't have to fear going to jail	['Relation', 'Relation', 'Relation']	Relation
8193	my opponent 's wants to fully legalize are extremely , extremely dangerous the drugs to personal health	['NoRelation', 'NoRelation', 'NoRelation']	NoRelation
8205	legalizing drugs will not hurt public health	['NoRelation', 'NoRelation', 'NoRelation']	NoRelation
8206	lsd is less addictive than both these common , legal drugs , as well as causing fewer health problems , and even having some health benefits	['Relation', 'Relation', 'Relation']	Relation
8222	the health risks to they are very high if drugs were legalized	['NoisySentence', 'NoRelation', 'Relation']	NoAgreement
8226	the cost of productivity loss is reasonable to say that the impact of legalizing drugs use/sales would increase the health care	['Relation', 'Relation', 'Relation']	Relation
8249	we realize that banning flavored milk will not lead to decreased consumption in the long term	['NoRelation', 'NoRelation', 'NoRelation']	NoRelation
8254	wrong to ban local coca to prevent foreign cocaine consumption	['Relation', 'NoisySentence', 'Relation']	Relation
8257	one way that the white house could cut down the cancer rate in the united states of america is by banning the production and consumption of cigarettes !	['Relation', 'Relation', 'Relation']	Relation
8259	ban the consumption of dog meat in countries consume dog meat	['NoRelation', 'NoRelation', 'NoRelation']	NoRelation
8278	banning flavored milk will not decrease overall milk consumption in the long term	['NoRelation', 'NoRelation', 'NoRelation']	NoRelation
8286	impaired driving is also a contributor to thousands of deaths a year , so should we also place a ban on alcohol consumption	['Relation', 'Relation', 'Relation']	Relation
8303	a smoking ban would be impractical due to lost tax revenuethere are three main methods of tobacco consumption : cigarettes , cigars , and smokeless tobacco	['NoisySentence', 'NoRelation', 'NoRelation']	NoRelation
8310	a ) banning alcohol will not stop consumption	['NoRelation', 'NoRelation', 'NoRelation']	NoRelation
8358	the drug war has instead fueled massive criminal syndicates	['Relation', 'Relation', 'Relation']	Relation
8360	a ) war on drugs the main issue of the war due to the creation of organized crime	['Relation', 'Relation', 'Relation']	Relation
8362	the war on drugs has turned out just like prohibition more drugs , more violence , and more organized crime	['Relation', 'Relation', 'Relation']	Relation
8367	people of color are incarcerated by the criminal justice system at disproportionate rates particularly as a result of the war on drugs	['NoRelation', 'NoRelation', 'NoisySentence']	NoRelation
8370	the war on drugs and all other wars on drugs mirrors prohibition in everything from bathtub gin and designer drugs to gang activity fueled by the alcohol and drugs , al capone and the drug cartels , lives lost	['NoRelation', 'Relation', 'NoRelation']	NoRelation
8393	trumps immigration reform calls for tripling cooperation between ice officers and local police to combat the gang and drug war spilling over the entire border	['Relation', 'Relation', 'NoisySentence']	Relation
8395	drug related crimes are winning the war on drugs	['Relation', 'NoRelation', 'Relation']	Relation
8399	my opponent 's reasons for ending the war on drugs are as follows : a ) the war on drugs takes up too much of our budget b ) the war on drugs c ) it would bring more attention to other crimes d ) it puts many people in jail and destroys families here are my opponent 's responses : a ) it takes up $ billion in 2008 as suggested by your source	['Relation', 'NoRelation', 'Relation']	Relation
8412	child sex trade , poverty , drugs , criminals and both underground and surface wars	['NoRelation', 'NoRelation', 'NoRelation']	NoRelation
8415	the war on drugs is about disempowering criminals	['Relation', 'Relation', 'Relation']	Relation
8419	both violent and property crime by blacks are consistently lower each year , leading the the brookings institute study to conclude that the drug war has a profoundly negative effect on racial equality , and on rates of upward mobility	['Relation', 'Relation', 'Relation']	Relation
8422	trumps immigration reform calls for tripling the number of ice officers to combat the gang and drug war spilling over the entire border	['Relation', 'NoRelation', 'Relation']	Relation
8429	my believe that a carefully regulated system of the taxed drugs would be a safe and easy way to curtail gang revenue , ensure drug treatment , recieve economic bonuses from the taxed drugs , and end the wasteful spending of the war on drugs , as well as ensure people their liberties , something a conservative like	['Relation', 'NoRelation', 'Relation']	Relation
8439	an assault weapon ban might not significantly reduce the average 90 americans killed by guns each day	['Relation', 'Relation', 'Relation']	Relation
8444	it misses is the extent to which assault weapons enable deranged individuals to kill massively	['Relation', 'Relation', 'Relation']	Relation
8447	is the person with a gun to someone else ss ' head justified in killing an innocent kitten , even if carrying a kitten for that amount of time would hinder someone else 's from doing things	['Relation', 'Relation', 'Relation']	Relation
8454	assault weapons were designed to kill people	['Relation', 'Relation', 'Relation']	Relation
8468	assault weapons were designed to kill people ''	['Relation', 'Relation', 'NoRelation']	Relation
8488	essentially saying conceal carry laws make my former argument harder for the psycho to kill when in the area where a conceal carry permit holder , another question would be does permit holder lower crime committed with guns	['Relation', 'NoRelation', 'Relation']	Relation
8489	see : in massachusetts , where assault weapons are banned , firearms kill three out of 100,000 people each year	['Relation', 'NoRelation', 'Relation']	Relation
8501	this obliterates my argument assault weapons some how have greater capabilities of killing people	['NoRelation', 'Relation', 'Relation']	Relation
8513	scientists in australia followed nearly 4,000 young adults born between 1981 and 1984 at the 21 year mark , and found that the longer study participants had used marijuana , the higher the risk of psychosis related outcomes	['Relation', 'Relation', 'Relation']	Relation
8518	a distinct schizophrenia like psychosis were caused by cannabis	['Relation', 'Relation', 'Relation']	Relation
8525	acute toxic psychosis ( one of the very conditions marijuana is being used experimentally to treat ) were depersonalization	['NoisySentence', 'NoRelation', 'NoRelation']	NoRelation
8532	marijuana users may experience acute toxic psychosis	['Relation', 'NoRelation', 'NoRelation']	NoRelation
8536	comorbidity between cannabis use and psychosis : modelling some possible relationships	['NoRelation', 'NoRelation', 'NoRelation']	NoRelation
8538	marijuana also can give your psychosis and schizophrenia	['Relation', 'Relation', 'Relation']	Relation
8544	marijuana has been linked to the acceleration of mental disorders such as paranoia , depression , uncontrollable aggression , bipolar psychosis , schizophrenia , etc	['Relation', 'Relation', 'Relation']	Relation
8549	marijuana is linked to schizophrenia and psychosis	['NoRelation', 'NoRelation', 'Relation']	NoRelation
8561	cannabis use is associated with poor outcomes in existing psychosis	['Relation', 'Relation', 'Relation']	Relation
8567	cannabis use can appear to be the cause of the psychosis	['NoisySentence', 'Relation', 'Relation']	Relation
8578	a professional athlete uses performance enhancing drugs	['NoRelation', 'NoRelation', 'Relation']	NoRelation
8579	rumor has neurological damage that the nfl may introduce marijuana to combat concussions in athletes	['NoRelation', 'NoisySentence', 'NoisySentence']	NoisySentence
8604	not only are such young athletes unable to make a fully rational , informed choice about drug taking , the health impacts upon growing bodies would be even worse than for adult users	['Relation', 'Relation', 'NoRelation']	Relation
8610	first , to protect athletes from harmful drugs	['NoRelation', 'NoRelation', 'NoRelation']	NoRelation
8617	marijuana is and/or athletic performance	['NoisySentence', 'NoisySentence', 'NoRelation']	NoisySentence
8624	athletes who take drugs have a negative effect on other people	['Relation', 'Relation', 'NoRelation']	Relation
8627	athletes on drugs today often take far more than is needed for performance enhancement , running needless health risks	['NoRelation', 'Relation', 'NoisySentence']	NoAgreement
8633	enacting the legalization of drug use in sports seeks an unfair advantage towards other athletes and sets a bad perception on how athletes should compete in sports	['NoisySentence', 'NoisySentence', 'Relation']	NoisySentence
8638	he has caused the death the poverty the diseases	['NoisySentence', 'NoRelation', 'NoRelation']	NoRelation
8639	if disease is not widespread , how will disease result in poverty	['NoisySentence', 'Relation', 'NoRelation']	NoAgreement
8642	there 'd be too many , would spread disease , and cause destruction , and be in start poverty much more	['NoRelation', 'NoRelation', 'NoRelation']	NoRelation
8644	c2 : living conditions were worse for the victims of nazism than the victims of resulted in its living poverty , when victims of nazism had to live in the ghettos , concentration camps , and extermination camps ( otherwise known by its lesser term death camps ) where they became vulnerable to diseases , such as cholera and any moment knowing that you might be sent to be killed by being shot , or	['NoRelation', 'NoisySentence', 'Relation']	NoAgreement
8649	this is from diseases like hiv whos : the more poverty	['NoRelation', 'NoRelation', 'NoRelation']	NoRelation
8653	population control = massacres are starvation , death by poverty and disease	['Relation', 'Relation', 'NoRelation']	Relation
8659	many of today 's most critical issues military competition , nuclear proliferation financial crises , poverty , weak and ineffective governments , unresolved territorial disputes , growing competition over energy and natural resources , climate change , and disease transcend national borders and pose a common risk in the dynamic asia pacific region	['NoRelation', 'NoRelation', 'NoisySentence']	NoRelation
8662	natural forces such as disease , hunger , poverty , and general bad quality of life kill of the excess	['Relation', 'NoRelation', 'NoRelation']	NoRelation
8664	this was to combat poverty , disease , and social disruption	['NoRelation', 'NoRelation', 'NoRelation']	NoRelation
8667	diseases of poverty ' were diseases	['NoRelation', 'NoRelation', 'NoRelation']	NoRelation
8668	diseases by a substantial margin decreasing poverty also has the same effects	['Relation', 'NoisySentence', 'Relation']	Relation
8671	programs fight poverty and disease overseas	['Relation', 'Relation', 'Relation']	Relation
8674	aids makes the reduction of poverty via implementing a living way a key way to fighting the spread of deadly diseases such as aids	['NoRelation', 'Relation', 'Relation']	Relation
8684	this is to be a place where billions of people end up in intense suffering ( diseases deep poverty )	['NoRelation', 'NoRelation', 'NoRelation']	NoRelation
8709	the death the poverty the diseases were the horror of the world	['NoRelation', 'NoRelation', 'NoRelation']	NoRelation
8710	civil war , ethnic conflict , poverty and disease ravaged ordinary africans	['Relation', 'Relation', 'Relation']	Relation
8718	non circumcised penises can harbor cervix cancer	['Relation', 'NoRelation', 'Relation']	Relation
8722	only 10 of 50,000 cases of penile cancer in the usa from 1930 to 1990 , resulting in 10,000 deaths [ 14 ] occurred in circumcised men	['Relation', 'NoRelation', 'Relation']	Relation
8746	prostate cancer and women whose partners are circumcised have lower rates of cervical cancer	['Relation', 'Relation', 'NoRelation']	Relation
8747	the main reasons to not ban circumcision include decreased risk of penile cancer	['Relation', 'Relation', 'NoRelation']	Relation
8750	some things might prevent the other problems of not being vegetarian	['Relation', 'NoRelation', 'Relation']	Relation
8760	health problems were related to vegetarianism and fatty acid deficiency	['Relation', 'NoRelation', 'Relation']	Relation
8761	a vegetarian is probably going to have problems	['NoRelation', 'Relation', 'NoRelation']	NoRelation
8770	( us department of agriculture ( usda ) ) ) studies comparing vegetarians and meat eaters no meat lowered the risks of certain health problems , including heart disease , diabetes , cancer ''	['Relation', 'Relation', 'Relation']	Relation
8776	yes , people are becoming vegetarians , but then people also open people up to a host of problems	['NoRelation', 'NoRelation', 'NoRelation']	NoRelation
8786	( us department of agriculture ( usda ) ) ) studies comparing vegetarians and meat eaters no meat lowered the risks of certain health problems , including heart disease , diabetes , strokes ''	['Relation', 'NoisySentence', 'Relation']	Relation
8787	vegetarian diets are linked to menstrual problems in young women	['Relation', 'Relation', 'Relation']	Relation
